{"byteLength":73768,"collectorVersion":"jr-east-http/1.0.0","contentType":"text/html","httpStatus":200,"operator":"jr-east","requestedAt":"2026-09-27T10:30:25.270Z","schemaVersion":"1.0","sha256":"a24f8a96883ab662d24dc41a6255be96689b214bf15d581189984a4bd694fa48","sourceEdition":"2610","sourceType":"station-timetable-html","sourceUrl":"https://timetables.jreast.co.jp/2610/timetable/tt0866/0866031.html"}
