{"byteLength":291565,"collectorVersion":"jr-east-http/1.0.0","contentType":"text/html","httpStatus":200,"operator":"jr-east","requestedAt":"2026-09-27T10:30:30.172Z","schemaVersion":"1.0","sha256":"fb7b231fc2df36b679030892d815ad99d1d2edb88937bdae2d69f767310bd52a","sourceEdition":"2610","sourceType":"keihin-tohoku-matrix-html","sourceUrl":"https://timetables.jreast.co.jp/2610/timetable-v/623u1.html"}
