{"byteLength":30811,"collectorVersion":"jr-east-http/1.0.0","contentType":"text/html","httpStatus":200,"operator":"jr-east","requestedAt":"2026-09-27T10:30:22.840Z","schemaVersion":"1.0","sha256":"d12bd3f0c292b9c167d696b799a9f0c7384920c8536e7e77593fe3c1ca47d80f","sourceEdition":"2610","sourceType":"train-detail-html","sourceUrl":"https://timetables.jreast.co.jp/2610/train/155/157521.html"}
