{"byteLength":224846,"collectorVersion":"jr-east-http/1.0.0","contentType":"text/html","httpStatus":200,"operator":"jr-east","requestedAt":"2026-09-27T10:23:47.909Z","schemaVersion":"1.0","sha256":"1b17f534761c26a95cc0ac941ecab1c3fd5811eb026f1ec4a9e54fe5b84a5203","sourceEdition":"2610","sourceType":"chuo-rapid-matrix-html","sourceUrl":"https://timetables.jreast.co.jp/2610/timetable-v/658d1.html"}
