{"byteLength":336289,"collectorVersion":"jr-east-http/1.0.0","contentType":"text/html","httpStatus":200,"operator":"jr-east","requestedAt":"2026-09-27T10:23:52.474Z","schemaVersion":"1.0","sha256":"e67fa1c0b6dc3f2f1e0d912e553041269ab311185a43fd781e93393dcbf8791a","sourceEdition":"2610","sourceType":"chuo-sobu-local-matrix-html","sourceUrl":"https://timetables.jreast.co.jp/2610/timetable-v/659u1.html"}
