{"byteLength":23232,"collectorVersion":"jr-east-http/1.0.0","contentType":"text/html","httpStatus":200,"operator":"jr-east","requestedAt":"2026-09-27T10:23:52.173Z","schemaVersion":"1.0","sha256":"21f5f44cef8f2c9d8288fccca97ef3ecc689debe361658e7c55bfcf536440157","sourceEdition":"2610","sourceType":"station-index-html","sourceUrl":"https://timetables.jreast.co.jp/timetable/list0866.html"}
