{"byteLength":26956,"collectorVersion":"jr-east-http/1.0.0","contentType":"text/html","httpStatus":200,"operator":"jr-east","requestedAt":"2026-09-27T10:23:56.484Z","schemaVersion":"1.0","sha256":"bc67e64d5924558d0db34b9414aabb74143f4e0c06d085e7a17e8ab9e119a497","sourceEdition":"2610","sourceType":"edition-index-html","sourceUrl":"https://timetables.jreast.co.jp/"}
